{
  "schema_version": "2.0-rc1",
  "issue_id": "2026-W33",
  "publication_profile": "WEEKLY_MAGAZINE",
  "status": "PASSED",
  "scanned_surfaces": [
    {
      "path": "surveys/weekly/2026-W33/main.tex",
      "sha256": "eaa53931618f3743945159b6e816b62541ca1b1945be5bc472816521fa9f1eee",
      "kind": "PRIMARY_SOURCE",
      "byte_count": 2202
    },
    {
      "path": "surveys/weekly/2026-W33/references.bib",
      "sha256": "4c832136678ccebfaf4f73e0d8a5ecc281a080d0189743f6f0541998d1f96dc0",
      "kind": "BIBLIOGRAPHY",
      "byte_count": 172
    },
    {
      "path": "surveys/weekly/2026-W33/jgaisurvey.sty",
      "sha256": "035645caa06eb77e5416ae7a54bc1fb7b987e0b575a02bd4b512bccb5d683aec",
      "kind": "SUPPORTING_SOURCE",
      "byte_count": 6569
    },
    {
      "path": "sources/2026-W33/publication/v2/reader-manuscript-v2.json",
      "sha256": "694c0e3dea18fc8725c5e243bafca0729c9a04861c8652cfc7a0b4464772ba7b",
      "kind": "MANUSCRIPT_MANIFEST",
      "byte_count": 1922
    },
    {
      "path": "sources/2026-W33/publication/v2/reader-surface-input-v2.json",
      "sha256": "2e1b35fd6349ffd9a20d3061dbff812f74ea19361a57b3ceef5e2a97ee323354",
      "kind": "STRUCTURED_READER_SURFACE",
      "byte_count": 3230
    }
  ],
  "rules_checked": [
    {
      "rule_id": "RSG-LEX-CORE-VOCAB",
      "layer": "LEXICAL_LINT",
      "description": "Core v2 pipeline and architecture internal terminology in reader-facing prose",
      "severity": "BLOCKING"
    },
    {
      "rule_id": "RSG-LEX-SELECTION-SCREENING",
      "layer": "LEXICAL_LINT",
      "description": "Candidate screening, selection rounds, and negative selection decisions in reader prose",
      "severity": "BLOCKING"
    },
    {
      "rule_id": "RSG-LEX-DISCOVERY-INTAKE",
      "layer": "LEXICAL_LINT",
      "description": "Discovery intake, observation metadata, and candidate reviews in reader prose",
      "severity": "BLOCKING"
    },
    {
      "rule_id": "RSG-LEX-VERIFICATION-MATERIALITY",
      "layer": "LEXICAL_LINT",
      "description": "Internal verification obligations and materiality markers in reader prose",
      "severity": "BLOCKING"
    },
    {
      "rule_id": "RSG-LEX-INTERNAL-IDENTIFIERS",
      "layer": "LEXICAL_LINT",
      "description": "Internal package identifiers and raw evidence IDs in reader prose",
      "severity": "BLOCKING"
    },
    {
      "rule_id": "RSG-LEX-STAGE-LIFECYCLE",
      "layer": "LEXICAL_LINT",
      "description": "Internal stage and checkpoint lifecycle names used as publication prose",
      "severity": "BLOCKING"
    },
    {
      "rule_id": "RSG-LEX-INTERNAL-PATHS",
      "layer": "LEXICAL_LINT",
      "description": "Internal repository, transport, or Grok paths in reader prose or URLs",
      "severity": "BLOCKING"
    },
    {
      "rule_id": "RSG-LEX-BIBLIOGRAPHY-LEAKAGE",
      "layer": "LEXICAL_LINT",
      "description": "Internal evidence tags and materiality leaked into bibliography records",
      "severity": "BLOCKING"
    },
    {
      "rule_id": "RSG-LEX-EDITORIAL-PROCESS",
      "layer": "LEXICAL_LINT",
      "description": "Internal editorial operations explained as prose rather than underlying facts",
      "severity": "BLOCKING"
    },
    {
      "rule_id": "RSG-LEX-REVIEW-RATIONALE-COP-OUT",
      "layer": "LEXICAL_LINT",
      "description": "Architecture review meta-rebuttals and cop-out coverage assertions",
      "severity": "BLOCKING"
    },
    {
      "rule_id": "RSG-SEM-PROCESS-LEAKAGE",
      "layer": "SEMANTIC_REVIEW",
      "description": "Reader-facing sentence requiring internal pipeline knowledge to make sense",
      "severity": "BLOCKING"
    }
  ],
  "suppressions": [],
  "findings": [],
  "summary": {
    "total_findings": 0,
    "blocking_findings": 0,
    "warning_findings": 0,
    "suppressed_findings": 0,
    "normalized_findings": 0,
    "verdict": "PASSED"
  },
  "evaluated_by": "SYNTHETIC_FIXTURE_REVIEWER_GENERAL_FULL_V2",
  "recorded_at": "2026-10-28T06:00:00Z",
  "derivation": {
    "route": "WEEKLY_GENERATED_V2",
    "scope": "WEEKLY_MAIN_BIB_STYLE",
    "receipt": {
      "path": "sources/2026-W33/publication/v2/validated-source-manifest.json",
      "sha256": "27e22893be6c68a434bbeea3e7be8794bce16c7b53d6f2bcdf57d6642cfb9bdc"
    }
  },
  "semantic_authority": {
    "status": "PASSED",
    "decision": "PASS",
    "reviewed_by": "SYNTHETIC_FIXTURE_REVIEWER_GENERAL_FULL_V2",
    "surface_path": "sources/2026-W33/publication/v2/reader-surface-input-v2.json",
    "surface_sha256": "2e1b35fd6349ffd9a20d3061dbff812f74ea19361a57b3ceef5e2a97ee323354",
    "recorded_at": "2026-10-28T06:00:00Z",
    "reviewed_at": "2026-10-28T06:00:00Z",
    "review_path": "sources/2026-W33/publication/v2/reader-surface-semantic-review-v2.json",
    "review_sha256": "32519808a84ffdb8d2714776b309ba21dc1ac7a6cc59dabc3c8637609de1e5ba",
    "summary": "Bound semantic review passed"
  },
  "gate_sha256": "40f00c8a0a08d1dce6e64cabc6f32355a3954a9b3a593d5bac30f6a49fc23e1a"
}
