{
  "schema_version": "2.0-rc1",
  "issue_id": "SP001",
  "publication_profile": "LONGFORM_SPECIAL",
  "status": "PASSED",
  "scanned_surfaces": [
    {
      "path": "surveys/special/SP001/main.tex",
      "sha256": "3f4dfaf11ccc8284a86ccc419bf323339951115f6f663905eecdf017f6068de5",
      "kind": "PRIMARY_SOURCE",
      "byte_count": 5787
    },
    {
      "path": "surveys/special/SP001/references.bib",
      "sha256": "594e229e425c3f12a6794f1e82a4ae4f9190ab575f958f49617b00af111a394f",
      "kind": "BIBLIOGRAPHY",
      "byte_count": 177
    },
    {
      "path": "surveys/special/SP001/jgaisurvey.sty",
      "sha256": "035645caa06eb77e5416ae7a54bc1fb7b987e0b575a02bd4b512bccb5d683aec",
      "kind": "SUPPORTING_SOURCE",
      "byte_count": 6569
    },
    {
      "path": "sources/SP001/publication/v2/reader-manuscript-v2.json",
      "sha256": "b444d6c7ab6b7a1a9b9d9b1e28615efc164f118d7ed896a6783df5f196224847",
      "kind": "MANUSCRIPT_MANIFEST",
      "byte_count": 1740
    }
  ],
  "rules_checked": [
    {
      "rule_id": "RSG-LEX-CORE-VOCAB",
      "layer": "LEXICAL_LINT",
      "description": "Core v2 pipeline and architecture internal terminology in reader-facing prose",
      "severity": "BLOCKING"
    },
    {
      "rule_id": "RSG-LEX-SELECTION-SCREENING",
      "layer": "LEXICAL_LINT",
      "description": "Candidate screening, selection rounds, and negative selection decisions in reader prose",
      "severity": "BLOCKING"
    },
    {
      "rule_id": "RSG-LEX-DISCOVERY-INTAKE",
      "layer": "LEXICAL_LINT",
      "description": "Discovery intake, observation metadata, and candidate reviews in reader prose",
      "severity": "BLOCKING"
    },
    {
      "rule_id": "RSG-LEX-VERIFICATION-MATERIALITY",
      "layer": "LEXICAL_LINT",
      "description": "Internal verification obligations and materiality markers in reader prose",
      "severity": "BLOCKING"
    },
    {
      "rule_id": "RSG-LEX-INTERNAL-IDENTIFIERS",
      "layer": "LEXICAL_LINT",
      "description": "Internal package identifiers and raw evidence IDs in reader prose",
      "severity": "BLOCKING"
    },
    {
      "rule_id": "RSG-LEX-STAGE-LIFECYCLE",
      "layer": "LEXICAL_LINT",
      "description": "Internal stage and checkpoint lifecycle names used as publication prose",
      "severity": "BLOCKING"
    },
    {
      "rule_id": "RSG-LEX-INTERNAL-PATHS",
      "layer": "LEXICAL_LINT",
      "description": "Internal repository, transport, or Grok paths in reader prose or URLs",
      "severity": "BLOCKING"
    },
    {
      "rule_id": "RSG-LEX-BIBLIOGRAPHY-LEAKAGE",
      "layer": "LEXICAL_LINT",
      "description": "Internal evidence tags and materiality leaked into bibliography records",
      "severity": "BLOCKING"
    },
    {
      "rule_id": "RSG-LEX-EDITORIAL-PROCESS",
      "layer": "LEXICAL_LINT",
      "description": "Internal editorial operations explained as prose rather than underlying facts",
      "severity": "BLOCKING"
    },
    {
      "rule_id": "RSG-LEX-REVIEW-RATIONALE-COP-OUT",
      "layer": "LEXICAL_LINT",
      "description": "Architecture review meta-rebuttals and cop-out coverage assertions",
      "severity": "BLOCKING"
    },
    {
      "rule_id": "RSG-SEM-PROCESS-LEAKAGE",
      "layer": "SEMANTIC_REVIEW",
      "description": "Reader-facing sentence requiring internal pipeline knowledge to make sense",
      "severity": "BLOCKING"
    }
  ],
  "suppressions": [],
  "findings": [],
  "summary": {
    "total_findings": 0,
    "blocking_findings": 0,
    "warning_findings": 0,
    "suppressed_findings": 0,
    "normalized_findings": 0,
    "verdict": "PASSED"
  },
  "evaluated_by": "SYNTHETIC_FIXTURE_REVIEWER_GENERAL_FULL_V2",
  "recorded_at": "2026-10-28T06:00:00Z",
  "derivation": {
    "route": "DIRECT_PRIMARY",
    "scope": "PRIMARY_ONLY"
  },
  "semantic_authority": {
    "status": "PASSED",
    "decision": "PASS",
    "reviewed_by": "SYNTHETIC_FIXTURE_REVIEWER_GENERAL_FULL_V2",
    "surface_path": "surveys/special/SP001/main.tex",
    "surface_sha256": "3f4dfaf11ccc8284a86ccc419bf323339951115f6f663905eecdf017f6068de5",
    "recorded_at": "2026-10-28T06:00:00Z",
    "reviewed_at": "2026-10-28T06:00:00Z",
    "review_path": "surveys/special/SP001/reader-surface-semantic-review-v2.json",
    "review_sha256": "b6d6e806d36b6b6b072684ba4acfa829bdbc012e3224de0b9982125cb2980e97",
    "summary": "Bound semantic review passed"
  },
  "gate_sha256": "cd2f69c114c04f72310fe6736874d3c0ba4cded6f66e9d0a81c38da229f8b3a1"
}
